,Mô tả,text_cleaned
46,bán khách sạn 4 sao mỹ khê sơn trà đà nẵngdiện tích 300m2tòa khách sạn mặt tiền hồ nghinh ( ngay công viên biển đông)mô tả:tòa khách sạn 18 tầng bao gồm 81 phòng và 12 căn hộ 2 phòng ngủthiết kế hiện đại nội thất sang trọng đầy đủ tiêu chuẩn khách sạn 4 saodòng tiền kinh doanh ổn địnhvị trí trung tâm du lịch biển tỷ lệ khai thác phòng trung bình hơn 80% mỗi năm bất chấp mọi thời điểmliên hệ ngay để trao đổi thêm thông tin,bán khách sạn 4 sao mỹ khê sơn trà đà nẵngdiện tích 300m2tòa khách sạn mặt tiền hồ nghinh ( ngay công viên biển đông)mô tả tòa khách sạn 18 tầng bao gồm 81 phòng và 12 căn hộ 2 phòng ngủthiết kế hiện đại nội thất sang trọng đầy đủ tiêu chuẩn khách sạn 4 saodòng tiền kinh doanh ổn địnhvị trí trung tâm du lịch biển tỷ lệ khai thác phòng trung bình hơn 80 mỗi năm bất chấp mọi thời điểmliên hệ ngay để trao đổi thêm thông tin
47,cần bán nhà 2 tầng đường lương thế vinh sơn trà đà nẵngdiện tích 100m2kiệt ô tô 3mnhà 2 tầng mới đẹp 3 phòng ngủ đầy đủ mọi công năngvị trí trung tâm diện tích lớn nhà đẹp vào ở ngayxung quanh đầy đủ mọi tiện ích không thiếu thứ gìkhu vực an ninh tốt gần sông gần biểnliên hệ ngay trao đổi thêm thông tin.,cần bán nhà 2 tầng đường lương thế vinh sơn trà đà nẵngdiện tích 100m2kiệt ô tô 3mnhà 2 tầng mới đẹp 3 phòng ngủ đầy đủ mọi công năngvị trí trung tâm diện tích lớn nhà đẹp vào ở ngay x ung quanh đầy đủ mọi tiện ích không thiếu thứ gìkhu vực an ninh tốt gần sông gần biểnliên hệ ngay trao đổi thêm thông tin.
48,"cần bán ngay lô đất khu nam việt á ngũ hành sơn đà nẵngdiện tích 85m2đường 5,5mvị trí ngay tại khu đô thị mới nam việt á quy hoạch bài bản đường thông hè thoángkhu an ninh tốt dân trí caovị trí trung tâm dễ dàng kết nốipháp lý hoàn chỉnhliên hệ ngay trao đổi thêm thông tin","cần bán ngay lô đất khu nam việt á ngũ hành sơn đà nẵngdiện tích 85m2đường 5,5mvị trí ngay tại khu đô thị mới nam việt á quy hoạch bài bản đường thông hè thoángkhu an ninh tốt dân trí caovị trí trung tâm dễ dàng kết nốipháp lý hoàn chỉnhliên hệ ngay trao đổi thêm thông tin"
49,bán nhà 4 tầng kiên cố mới đẹp kiệt ô tô võ văn kiệt sơn trà đà nẵngnhà 4 tầng 4 phong ngủ đầy đủ mọi công năngkiệt ô tôcách bãi biển mỹ khê chỉ 100mvị trí trung tâm gần biển vô vàn tiện íchnhà đẹp kiên cố vào ở luôngiá tốt không tìm thấy căn thứ 2liên hệ ngay để biết thêm thông tin,bán nhà 4 tầng kiên cố mới đẹp kiệt ô tô võ văn kiệt sơn trà đà nẵngnhà 4 tầng 4 phong ngủ đầy đủ mọi công năngkiệt ô tôcách bãi biển mỹ khê chỉ 100mvị trí trung tâm gần biển vô vàn tiện íchnhà đẹp kiên cố vào ở luôngiá tốt không tìm thấy căn thứ 2liên hệ ngay để biết thêm thông tin
50,bán gấp nhà 5 tầng nam việt á ngũ hành sơn đà nẵngdiện tích 170m2nhà 5 tầng mới đẹp vừa ở vừa kinh doanhnhà có 2 căn hộ 60m2 và 19 phòng đang cho thuê fulldoanh thu mỗi tháng thấp nhất 50 triệu/thángvừa ở vừa cho thuê dòng tiền ổn đinh hàng tháng.vị trí trung tâm dễ dàng kế nối tới trung tâmđường thông hè thoáng gần sông gần biểnliên hệ ngay để trao đổi thêm thông tin,bán gấp nhà 5 tầng nam việt á ngũ hành sơn đà nẵngdiện tích 170m2nhà 5 tầng mới đẹp vừa ở vừa kinh doanhnhà có 2 căn hộ 60m2 và 19 phòng đang cho thuê fulldoanh thu mỗi tháng thấp nhất 50 triệu/thángvừa ở vừa cho thuê dòng tiền ổn đinh hàng tháng.vị trí trung tâm dễ dàng kế nối tới trung tâmđường thông hè thoáng gần sông gần biểnliên hệ ngay để trao đổi thêm thông tin
51,"cần tiến bán gấp đất mặt biển mỹ khê võ nguyên giáp đà nẵngdiện tích 330 m2lô góc ngay đường võ nguyên giáp đối diện khu resort olalanivị trí trung tâm du lịch biển mỹ khê đà nẵngphù hợp xây dựng kinh doanh khách sạn, giữ tiền trong thời kì lạm phátvị trí hiếm có khó tìmliên hệ ngay để biết thêm thông tin","cần tiến bán gấp đất mặt biển mỹ khê võ nguyên giáp đà nẵngdiện tích 330 m2lô góc ngay đường võ nguyên giáp đối diện khu resort olalanivị trí trung tâm du lịch biển mỹ khê đà nẵngphù hợp xây dựng kinh doanh khách sạn, giữ tiền trong thời kì lạm phátvị trí hiếm có khó tìmliên hệ ngay để biết thêm thông tin"
52,"bán gấp nhà 4 tầng nam việt á đà nẵng gần sông hànđường dương tử giang cách sông hàn chỉ 100mdiện tích 90 m2đường 7,5mnhà 4 tầng mới đẹp ( xây 2021) nội thất siêu xịn. tất cả các phòng đón ánh sáng tự nhiênnhà 5 phòng ngủ đầy đủ mọi công năngđể lại toàn bộ nội thất xịn xò. vào ở ngay không sắm thứ gì.khu vực an ninh tốt dân trí caogần sông kề biển. khí hậu ôn hoà mát mẻ quanh năm. môi trường sống lý tưởng.hồ sơ pháp lý đầy đủliên hệ ngay để trao đổi thêm thông tin (lvcc)","bán gấp nhà 4 tầng nam việt á đà nẵng gần sông hànđường dương tử giang cách sông hàn chỉ 100mdiện tích 90 m2đường 7,5mnhà 4 tầng mới đẹp ( xây 2021) nội thất siêu xịn. tất cả các phòng đón ánh sáng tự nhiênnhà 5 phòng ngủ đầy đủ mọi công năngđể lại toàn bộ nội thất xịn xò. vào ở ngay không sắm thứ gì.khu vực an ninh tốt dân trí caogần sông kề biển. khí hậu ôn hoà mát mẻ quanh năm. môi trường sống lý tưởng.hồ sơ pháp lý đầy đủliên hệ ngay để trao đổi thêm thông tin (lvcc)"
53,"bán nhanh lô đất mặt tiền đường võ nguyên giáp đà nẵngvài bước chân ra bãi biển mỹ khê đẹp nhất hành tinhđối diện pullman resort, xunh quanh toàn khách sạndiện tích 14x20=280m2vị trí trung tâm du lịch biển mỹ khê phù hợp xây dựng khách sạn khai thác cho thuênhững lô đất cuối cùng trên cung biển mỹ khê võ nguyên giáp giá trị vô giá. pháp lý rõ ràng minh bạchliên hệ ngay trao đổi thêm thông tin.","bán nhanh lô đất mặt tiền đường võ nguyên giáp đà nẵngvài bước chân ra bãi biển mỹ khê đẹp nhất hành tinhđối diện pullman resort, xunh quanh toàn khách sạndiện tích 14 x 20 280m2vị trí trung tâm du lịch biển mỹ khê phù hợp xây dựng khách sạn khai thác cho thuênhững lô đất cuối cùng trên cung biển mỹ khê võ nguyên giáp giá trị vô giá. pháp lý rõ ràng minh bạchliên hệ ngay trao đổi thêm thông tin."
54,"bán gấp khách sạn biển mỹ khê đà nẵngmặt tiền võ nguyên giáp đối diện pullman resorttòa khách sạn 10 tầng 24 phòng, đầy đủ mọi công năngvị trí trung tâm du lịch biển doanh thu cao tỷ lệ lấp đầy phòng trên 75%vài bước chân ra bãi biển mỹ khê đẹp nhất hành tinhkhách sạn thiết kế hiện đại tinh tế, toàn bộ nội thất gỗ hương.pháp lý rõ ràng minh bạchliên hệ ngay để biết thêm thông tin chi tiết (dẫn xem nhà)","bán gấp khách sạn biển mỹ khê đà nẵngmặt tiền võ nguyên giáp đối diện pullman resorttòa khách sạn 10 tầng 24 phòng, đầy đủ mọi công năngvị trí trung tâm du lịch biển doanh thu cao tỷ lệ lấp đầy phòng trên 75 vài bước chân ra bãi biển mỹ khê đẹp nhất hành tinhkhách sạn thiết kế hiện đại tinh tế, toàn bộ nội thất gỗ hương.pháp lý rõ ràng minh bạchliên hệ ngay để biết thêm thông tin chi tiết (dẫn xem nhà)"
55,"bán gấp nhà 3 tầng mặt tiền phạm cự lượng sơn trà đà nẵngdiện tích 112 m2đường 7,5m lề 3mnhà 3 tầng 6 phòng ngủ đầy đủ mọi công năngnhà vừa ở vừa kinh doanh vừa cho thuêchủ kẹt tiền ngân hàng cần bán gấp giá rất tốt so với thị trườngvị trí trung tâm dễ dàng kết nối muôn và tiện ích\sổ đỏ đã được ngân hàng thẩm địnhliên hệ ngay để biết thêm thông tin","bán gấp nhà 3 tầng mặt tiền phạm cự lượng sơn trà đà nẵngdiện tích 112 m2đường 7,5m lề 3mnhà 3 tầng 6 phòng ngủ đầy đủ mọi công năngnhà vừa ở vừa kinh doanh vừa cho thuêchủ kẹt tiền ngân hàng cần bán gấp giá rất tốt so với thị trườngvị trí trung tâm dễ dàng kết nối muôn và tiện ích sổ đỏ đã được ngân hàng thẩm địnhliên hệ ngay để biết thêm thông tin"
56,"bán gấp nhà 2 tầng võ nguyên giáp đà nẵngđối diện khu resort furamadiện tích 67m2đường kiệt nhựa rộng 5m. nhà 2 mặt kiệt siêu thoángnhà 2 tầng cũ xác đinh chỉ bán đấtvị trí gần biển  mỹ khê hiếm có khó tìm giá tốtphù hợp để ở, xây khách sạn căn hộ liên hệ ngay để biết thêm thông tin","bán gấp nhà 2 tầng võ nguyên giáp đà nẵngđối diện khu resort furamadiện tích 67m2đường kiệt nhựa rộng 5m. nhà 2 mặt kiệt siêu thoángnhà 2 tầng cũ xác đinh chỉ bán đấtvị trí gần biển mỹ khê hiếm có khó tìm giá tốtphù hợp để ở, xây khách sạn căn hộ liên hệ ngay để biết thêm thông tin"
57,"cần tiền bán gấp nhà sát biển sơn trà đà nẵngdiện tích 55 m2nhà 3 tầng mới đẹp chủ xây tâm huyếtcông năng 3 phòng ngủ, wc,khách, bếp, phòng thờ sân phơinhà cách biển 40m mát mẻ quanh nămnhà lô góc 2 mặt kiệt rất thoángvị trí trung tâm gần biển hiếm có khó tìmliên hệ ngay để trao đổi thêm thông tin","cần tiền bán gấp nhà sát biển sơn trà đà nẵngdiện tích 55 m2nhà 3 tầng mới đẹp chủ xây tâm huyếtcông năng 3 phòng ngủ, wc,khách, bếp, phòng thờ sân phơinhà cách biển 40m mát mẻ quanh nămnhà lô góc 2 mặt kiệt rất thoángvị trí trung tâm gần biển hiếm có khó tìmliên hệ ngay để trao đổi thêm thông tin"
58,"bán nhà đường điện biên phủ, đà nẵng, nhà đẹp mới xây giá siêu rẻ 👉 2,xx tỷ- diện tích đất 50m, dtsd 100m- nhà 2 tầng, hướng tây bắc- cách đường chính đúng 10 bước chân- có ngủ dưới, 3 ngủ, 2wc, 1 thờ- tặng kèm nội thất vô ở liềnxem nhà cclh trực tiếp số điện thoại để xem mua nhé anh chị","bán nhà đường điện biên phủ, đà nẵng, nhà đẹp mới xây giá siêu rẻ 2, x x tỷ diện tích đất 50m, dtsd 100m nhà 2 tầng, hướng tây bắc cách đường chính đúng 10 bước chân có ngủ dưới, 3 ngủ, 2wc, 1 thờ tặng kèm nội thất vô ở liền x em nhà cclh trực tiếp số điện thoại để xem mua nhé anh chị"
59,"siêu phẩm nhà đẹp khu 409 trưng nữ vương, gần n hữu thọ & tiểu la, hải châu- nhà mới xây 3 tầng, kèm nội thất cao cấp- diện tích 75m, dtsd 225m- hướng bắc thuộc đông tứ trạch- có sân ô tô, có phòng ngủ dưới- 4 phòng ngủ, 4wc, 2 sân chill- đường nhựa 5-6m vị trí đẹp trung tâm tp- chính chủ bán có hổ trợ vay vốn 70%xem nhà liên hệ trực tiếp số điện thoại nhé quý anh chị","siêu phẩm nhà đẹp khu 409 trưng nữ vương, gần n hữu thọ tiểu la, hải châu nhà mới xây 3 tầng, kèm nội thất cao cấp diện tích 75m, dtsd 225m hướng bắc thuộc đông tứ trạch có sân ô tô, có phòng ngủ dưới 4 phòng ngủ, 4wc, 2 sân chill đường nhựa 5 6m vị trí đẹp trung tâm tp chính chủ bán có hổ trợ vay vốn 70 xem nhà liên hệ trực tiếp số điện thoại nhé quý anh chị"
60,"nhà 2,5 tầng k304 nguyễn phước nguyên, q thanh khê, thông ql1a 👉 2,120 tỷ- diện tích 52m (4 x 13) - hướng tây bắc, dtsd 125m- 3 phòng ngủ, 2wc, 1 thờ, giặc phơi- kiệt 2,5m cách đường cỡ 40mchính chủ bán rẻ quý anh chị xem mua gọi trực tiếp số điện thoại","nhà 2,5 tầng k304 nguyễn phước nguyên, q thanh khê, thông ql1a 2,120 tỷ diện tích 52m (4 x 13) hướng tây bắc, dtsd 125m 3 phòng ngủ, 2wc, 1 thờ, giặc phơi kiệt 2,5m cách đường cỡ 40mchính chủ bán rẻ quý anh chị xem mua gọi trực tiếp số điện thoại"
61,"bán 2 căn nhà đường hoàng diệu, q hải châu- diện tich đất 1 căn : 95m (5 x 19)- hướng đông mát mẻ- nhà 2 mê đúc xinh đẹp giữa lòng tp- có sân vườn hồ cá, đầy đủ nội thất- có phòng ngủ dưới & giặc phơi dưới - 3 ngủ, 3wc, 1 thờ, 1 sân rộng- kiệt 3m - 6m 356 hoàng diệuchính chủ cần bán có hổ trợ vay banklh xem nhà quý anh chị gọi trực tiếp số điện thoại","bán 2 căn nhà đường hoàng diệu, q hải châu diện tich đất 1 căn 95m (5 x 19) hướng đông mát mẻ nhà 2 mê đúc xinh đẹp giữa lòng tp có sân vườn hồ cá, đầy đủ nội thất có phòng ngủ dưới giặc phơi dưới 3 ngủ, 3wc, 1 thờ, 1 sân rộng kiệt 3m 6m 356 hoàng diệuchính chủ cần bán có hổ trợ vay banklh xem nhà quý anh chị gọi trực tiếp số điện thoại"
62,"nhà 3 tầng hoà xuân 👉 rẻ bèo 3,3 tỷ - đường 5,5m + lề mỗi bên 3m- đường nguyễn đoá gần văn tiến dũng- diện tích: 110m (5 x 22)- hướng: đông- nhà xây để ở, kiên cố, hiện đại, vì kẹt nên bán tháo siêu rẻ, ai có tiền hốt nhanh- công năng: 3 phòng ngủ( có phòng ngủ dưới), sân ô tô, khách, bếp, 3wc, sân phơi, thờ...liên hệ xem nhà mua quý anh chị hãy gọi trực tiếp số điện thoại","nhà 3 tầng hoà xuân rẻ bèo 3,3 tỷ đường 5,5m lề mỗi bên 3m đường nguyễn đoá gần văn tiến dũng diện tích 110m (5 x 22) hướng đông nhà xây để ở, kiên cố, hiện đại, vì kẹt nên bán tháo siêu rẻ, ai có tiền hốt nhanh công năng 3 phòng ngủ( có phòng ngủ dưới), sân ô tô, khách, bếp, 3wc, sân phơi, thờ...liên hệ xem nhà mua quý anh chị hãy gọi trực tiếp số điện thoại"
63,"nhà kiệt trần cao vân 👉 1,980 tỷsát chợ tam thuận đối diện nhà thờ tam toà cách đường trần cao vân 50mnhà 2 tầng ( nở hậu )có 2 phòng ngủ, 2wc, sân phơi sân phơidiện tích 40m, dtsd 80mlhcc quý anh chị gọi trực tiếp số điện thoại","nhà kiệt trần cao vân 1,980 tỷsát chợ tam thuận đối diện nhà thờ tam toà cách đường trần cao vân 50mnhà 2 tầng ( nở hậu )có 2 phòng ngủ, 2wc, sân phơi sân phơidiện tích 40m, dtsd 80mlhcc quý anh chị gọi trực tiếp số điện thoại"
64,"bán đất biển đà nẵng 👉 2,280 tỷđường đào công soạn, sát n tất thànhđường 5m5 + vỉa hè mỗi bên 3mdiện tích 73,5m (7 x 10,5)hướng tây bắc, khu đông dânquý anh chị xem đất mua lh trực tiếp số điện thoại","bán đất biển đà nẵng 2,280 tỷđường đào công soạn, sát n tất thànhđường 5m5 vỉa hè mỗi bên 3mdiện tích 73,5m (7 x 10,5)hướng tây bắc, khu đông dânquý anh chị xem đất mua lh trực tiếp số điện thoại"
65,"bán nhà 2 mặt tiền kiệt ô tô tô hiệu, ngay ngã 4 hoàng thị loan, cách biển 500m- nhà 3 tầng mới xây 9/2023, tặng nội thất- diện tích 63m (4,7 x 14)- hướng tây nam- 4 phòng, 4wc, sân đậu ô tô- kiệt ô tô 5m rộng rãixem nhà chính chủ bán quý anh chị gọi trực tiếp số điện thoạigiá : 3,680 tỷ có thương lượng","bán nhà 2 mặt tiền kiệt ô tô tô hiệu, ngay ngã 4 hoàng thị loan, cách biển 500m nhà 3 tầng mới xây 9/2023, tặng nội thất diện tích 63m (4,7 x 14) hướng tây nam 4 phòng, 4wc, sân đậu ô tô kiệt ô tô 5m rộng rãi x em nhà chính chủ bán quý anh chị gọi trực tiếp số điện thoạigiá 3,680 tỷ có thương lượng"
66,"bán 3 nhà mới xây 3 tầng k356 nguyễn phước nguyên, thanh khê 👉 tt 1,5 tỷ lấy nhà- vị trí siêu đẹp, nằm sau 1 căn mặt tiền- diện tích 51m, dtsd 152m- hướng tây bắc & hướng đông- có ngủ dưới, 4 ngủ, 3wc, thờ, giặc phơi- kiệt 3m cách đường chỉ có 10mchính chủ bán quý anh chị có nhu cầu xem mua xin gọi trực tiếp số điện thoại","bán 3 nhà mới xây 3 tầng k356 nguyễn phước nguyên, thanh khê tt 1,5 tỷ lấy nhà vị trí siêu đẹp, nằm sau 1 căn mặt tiền diện tích 51m, dtsd 152m hướng tây bắc hướng đông có ngủ dưới, 4 ngủ, 3wc, thờ, giặc phơi kiệt 3m cách đường chỉ có 10mchính chủ bán quý anh chị có nhu cầu xem mua xin gọi trực tiếp số điện thoại"
67,"bán nhà chính chủ thanh lương 15, hoà xuân, gần nguyễn phước lan 👉 4 tỷ x- đường 7m5, lề 8m 2 bên- diện tích 100m (5 x 20)- nhà 3 tầng đúc, hướng đông nam- 3 ngủ, có ngủ dưới, 3wc, 1 thờ- có sân đậu ô tô, tặng kèm nội thấtxem nhà lh trực tiếp vào số điện thoại để được dẫn đi xem mua","bán nhà chính chủ thanh lương 15, hoà xuân, gần nguyễn phước lan 4 tỷ x đường 7m5, lề 8m 2 bên diện tích 100m (5 x 20) nhà 3 tầng đúc, hướng đông nam 3 ngủ, có ngủ dưới, 3wc, 1 thờ có sân đậu ô tô, tặng kèm nội thất x em nhà lh trực tiếp vào số điện thoại để được dẫn đi xem mua"
68,"🆘 mô tả:🍀 vị trí trung tâm quận sơn trà, nằm giữa trục đường ngô quyền - nguyễn công trứ - phạm văn đồng - võ nguyên giáp - dương đình nghệ - hồ nghinh. du lịch phát triển nhất đà nẵng. 🍀 diện tích đất 73m2, ngang 4m nở hậu. nhà 2 tầng cũ, móng xây rất kiên cố có thể xây lên 3 tầng. thiết kế đẩy đủ công năng 3pn, 2wc, phòng thờ rộng... 🍀 đối diện nhà là công viên rất thoáng mát, 5 phút đi bộ ra trung tâm thương mại vincom. 10 phút ra biển, cầu rồng, cầu sông hàn.🍀 gần bệnh viện 199, công an quận sơn trà. an ninh rất tốt.☎️ liên hệ xem nhà và làm việc chính chủ.","mô tả vị trí trung tâm quận sơn trà, nằm giữa trục đường ngô quyền nguyễn công trứ phạm văn đồng võ nguyên giáp dương đình nghệ hồ nghinh. du lịch phát triển nhất đà nẵng. diện tích đất 73m2, ngang 4m nở hậu. nhà 2 tầng cũ, móng xây rất kiên cố có thể xây lên 3 tầng. thiết kế đẩy đủ công năng 3pn, 2wc, phòng thờ rộng... đối diện nhà là công viên rất thoáng mát, 5 phút đi bộ ra trung tâm thương mại vincom. 10 phút ra biển, cầu rồng, cầu sông hàn. gần bệnh viện 199, công an quận sơn trà. an ninh rất tốt. liên hệ xem nhà và làm việc chính chủ."
69,"🏠 mô tả:📍 vị trí đắc địa, kinh doanh cực tốt, xung quanh toàn cửa hàng, ngân hàng, siêu thị, nhà hàng lớn.💎 diện tích đất 107m2, mặt tiền 5m. sổ vuông vức, có lối thoát hiểm phía sau nhà rộng 1,5m.🎯 mặt tiền đường rộng 45m vỉa hè 5m. nhà cấp 4 cũ, chủ xác định bán đất tặng nhà.🍀 khu trung tâm thành phố, dân cư đông đúc, tiện ích khỏi phải bàn.","mô tả vị trí đắc địa, kinh doanh cực tốt, xung quanh toàn cửa hàng, ngân hàng, siêu thị, nhà hàng lớn. diện tích đất 107m2, mặt tiền 5m. sổ vuông vức, có lối thoát hiểm phía sau nhà rộng 1,5m. mặt tiền đường rộng 45m vỉa hè 5m. nhà cấp 4 cũ, chủ xác định bán đất tặng nhà. khu trung tâm thành phố, dân cư đông đúc, tiện ích khỏi phải bàn."
70,"🌈 mô tả:📍 vị trí rất đẹp: nơi tập trung rất nhiều khách du lịch, nhà ngay sau lưng dãy khách sạn cao 30-50 tầng như peninsula, fusion suites, hilton garden... và nhiều nhà hàng lớn.👉 chỉ 3 phút đi bộ là ra đến biển, bãi tắm phạm văn đồng.👉 5 phút đến cầu sông hàn, lên chùa linh ứng, 10 phút đến cầu tình yêu, cầu rồng, 15 phút đến sân bay.🍀 diện tích đất rộng, mặt tiền 10m nở hậu. đường rộng, thoáng. rất phù hợp để kinh doanh khách sạn, toà căn hộ hoặc homestay.🎯 hiện trên đất có sắn 2 căn nhà:👉 căn 1: nhà 3 tầng, 3pn 3wc khép kín, phòng khách, bếp, sân... đầy đủ công năng.👉 căn 2: nhà 2 tầng riêng biệt, mỗi tầng có 1pn 1wc, phòng khách, bếp riêng.💎 khách mua nhà có thể sửa lại để làm toà căn hộ cho thuê.","mô tả vị trí rất đẹp nơi tập trung rất nhiều khách du lịch, nhà ngay sau lưng dãy khách sạn cao 30 50 tầng như peninsula, fusion suites, hilton garden... và nhiều nhà hàng lớn. chỉ 3 phút đi bộ là ra đến biển, bãi tắm phạm văn đồng. 5 phút đến cầu sông hàn, lên chùa linh ứng, 10 phút đến cầu tình yêu, cầu rồng, 15 phút đến sân bay. diện tích đất rộng, mặt tiền 10m nở hậu. đường rộng, thoáng. rất phù hợp để kinh doanh khách sạn, toà căn hộ hoặc homestay. hiện trên đất có sắn 2 căn nhà căn 1 nhà 3 tầng, 3pn 3wc khép kín, phòng khách, bếp, sân... đầy đủ công năng. căn 2 nhà 2 tầng riêng biệt, mỗi tầng có 1pn 1wc, phòng khách, bếp riêng. khách mua nhà có thể sửa lại để làm toà căn hộ cho thuê."
71,"🌈 mô tả: 💰 chỉ nhỉnh 60 triệu/m2 cả xây dựng cho căn biệt thự đẳng cấp.🔴 biệt thự mini lô góc 2 mặt tiền đường 10,5m vỉa hè 5m và đường 5,5m vỉa hè 3m rất thoáng mát.🟠 vị trí nằm ngay trên trục đường chu huy mân lên cầu thuận phước. xung quanh toàn toà khách sạn, biệt thự vip.🟡 diện tích đất 155m2 ngang 8m. khu quy hoạch phân lô bàn cờ rất đẹp, cơ sở vật chất hạ tầng hoàn thiện.🟢 xây dựng 3 tầng kiên cố, thiết kế hiện đại, trẻ trung, đẳng cấp, phòng nào cũng có ánh sáng, gió tự nhiên. 🔵 full nội thất cao cấp, hệ thống điện năng lượng mặt trời hơn, giàn trồng cây thuỷ canh xịn xò...🟣 thiết kế: - tầng 1: mặt bằng kinh doanh + 1wc, 1 pn + wc khép kín, gara để xe ô tô.- tầng 2: phòng khách, bếp, thờ, giặt đồ, 2pn khép kín, 1 phòng gym và 1 wc ngoài.- tầng 3: sân chill, hồ bơi, vườn rau, phòng xông hơi và 1 wc.","mô tả chỉ nhỉnh 60 triệu/m2 cả xây dựng cho căn biệt thự đẳng cấp. biệt thự mini lô góc 2 mặt tiền đường 10,5m vỉa hè 5m và đường 5,5m vỉa hè 3m rất thoáng mát. vị trí nằm ngay trên trục đường chu huy mân lên cầu thuận phước. xung quanh toàn toà khách sạn, biệt thự vip. diện tích đất 155m2 ngang 8m. khu quy hoạch phân lô bàn cờ rất đẹp, cơ sở vật chất hạ tầng hoàn thiện. xây dựng 3 tầng kiên cố, thiết kế hiện đại, trẻ trung, đẳng cấp, phòng nào cũng có ánh sáng, gió tự nhiên. full nội thất cao cấp, hệ thống điện năng lượng mặt trời hơn, giàn trồng cây thuỷ canh xịn xò... thiết kế tầng 1 mặt bằng kinh doanh 1wc, 1 pn wc khép kín, gara để xe ô tô. tầng 2 phòng khách, bếp, thờ, giặt đồ, 2pn khép kín, 1 phòng gym và 1 wc ngoài. tầng 3 sân chill, hồ bơi, vườn rau, phòng xông hơi và 1 wc."
