,Mô tả,text_cleaned
72,"🌈 mô tả:♦️ nhà cấp 4 gồm: 2pn, phòng khách, bếp, wc, dân để xe rộng.🔸 kiệt rộng 6m, ô tô đậu đỗ thoải mái. kiệt rộng thông ra nguyễn sinh sắc, đi lại rất tiện.🔹 nhà gần trường đh sư phạm, đh bách khoa, cđ kinh tế kế hoạch, sát nhà là trường mẫu giáo.🍀 khu làng sinh viên, phố ăn vặt rất nhộn nhịp, tiện ích đẩy đủ cách nhà chỉ vài bước chân.☎️ liên hệ xem nhà và làm việc chính chủ","mô tả nhà cấp 4 gồm 2pn, phòng khách, bếp, wc, dân để xe rộng. kiệt rộng 6m, ô tô đậu đỗ thoải mái. kiệt rộng thông ra nguyễn sinh sắc, đi lại rất tiện. nhà gần trường đh sư phạm, đh bách khoa, cđ kinh tế kế hoạch, sát nhà là trường mẫu giáo. khu làng sinh viên, phố ăn vặt rất nhộn nhịp, tiện ích đẩy đủ cách nhà chỉ vài bước chân. liên hệ xem nhà và làm việc chính chủ"
73,"mô tả:- nhà 2 mặt kiệt rộng 5m, ô tô đậu đỗ thoải mái.- nhà mới xây kiên cố. sổ nở hậu tài lộc.- thiết kế: 3 phòng ngủ, 2 toilet, phòng thờ, sân phơi.- khu vực dân cư đông đúc, giao thông thuận tiện. an ninh đảm bảo.","mô tả nhà 2 mặt kiệt rộng 5m, ô tô đậu đỗ thoải mái. nhà mới xây kiên cố. sổ nở hậu tài lộc. thiết kế 3 phòng ngủ, 2 toilet, phòng thờ, sân phơi. khu vực dân cư đông đúc, giao thông thuận tiện. an ninh đảm bảo."
74,"🎯 mô tả: 👉 vị trí trung tâm quận liên chiểu. gần ngã ba huế và các trường đh sư phạm, bách khoa, cđ kinh tế kế hoạch, bến xe tt đà nẵng, hòa khánh, tuyến đường hải sản và tắm biển nguyễn tất thành.👉 mặt tiền đường 7.5m, ô tô đậu đỗ ngày đêm. nhà phù hợp vừa ở vừa kinh doanh, mở văn phòng, công ty, spa...👉 nhà mới đẹp, thiết kế hiện đại, sang trọng, đẩy đủ công năng. full nội thất xịn.- tầng 1: sân, phòng khách, bếp, 1 ngủ, wc.- tầng 2: 2 ngủ khép kín, khu làm việc/đọc sách.- tầng 3: phòng thờ, 1 ngủ, wc, sân thượng.👉 sổ cất két, sẵn sàng giao dịch.👉 chủ thiện chí, cần bán nhanh giải quyết công việc.💰 giá chào bán: 5,x tỷ☎️ liên hệ: mr. chiến (chuyên mua - bán nhà đất quận liên chiểu)","mô tả vị trí trung tâm quận liên chiểu. gần ngã ba huế và các trường đh sư phạm, bách khoa, cđ kinh tế kế hoạch, bến xe tt đà nẵng, hòa khánh, tuyến đường hải sản và tắm biển nguyễn tất thành. mặt tiền đường 7.5m, ô tô đậu đỗ ngày đêm. nhà phù hợp vừa ở vừa kinh doanh, mở văn phòng, công ty, spa... nhà mới đẹp, thiết kế hiện đại, sang trọng, đẩy đủ công năng. full nội thất xịn. tầng 1 sân, phòng khách, bếp, 1 ngủ, wc. tầng 2 2 ngủ khép kín, khu làm việc/đọc sách. tầng 3 phòng thờ, 1 ngủ, wc, sân thượng. sổ cất két, sẵn sàng giao dịch. chủ thiện chí, cần bán nhanh giải quyết công việc. giá chào bán 5,x tỷ liên hệ mr. chiến (chuyên mua bán nhà đất quận liên chiểu)"
75,"🌈 mô tả:📍lô đất ở vị trí đắc địa: sát công viên hồ nghinh, chỉ 5 phút đi bộ ra bãi tắm biển đường võ nguyên giáp, phạm văn đồng. 💎 diện tích 100m2 khu phân lô, mặt tiền đường 5,5m vỉa hè 3m. xung quanh toàn toà khách sạn, apartment lớn. lượng khách du lịch tập trung đông.🎯 khu trung tâm du lịch, đầy đủ các tiện ích đẳng cấp. lô đất rất thích hợp để đầu tư xây khách sạn, toà apartment.☎️ liên hệ xem đất và làm việc chính chủ.","mô tả lô đất ở vị trí đắc địa sát công viên hồ nghinh, chỉ 5 phút đi bộ ra bãi tắm biển đường võ nguyên giáp, phạm văn đồng. diện tích 100m2 khu phân lô, mặt tiền đường 5,5m vỉa hè 3m. xung quanh toàn toà khách sạn, apartment lớn. lượng khách du lịch tập trung đông. khu trung tâm du lịch, đầy đủ các tiện ích đẳng cấp. lô đất rất thích hợp để đầu tư xây khách sạn, toà apartment. liên hệ xem đất và làm việc chính chủ."
76,"🏡 mô tả:📍vị trí cực đẹp: lô góc 2 mặt tiền đường 10,5m vỉa hè 5m và 7,5m vỉa hè 4m, view sông cẩm lệ rất thoáng mát, 200m tới trục đường võ chí công, qua cầu nguyễn tri phương là vào trung tâm tp.💎 khu vực đông dân cư, nhà ngay ngã 4 kinh doanh sầm uất, cơ sở hạ tầng hoàn thiện. rất thuận tiên kinh doanh hoặc mở trụ sở công ty.🍀 nhà hiện đang kinh doanh minimart và cửa hàng cafe, doanh thu ổn định.🔶 diện tích đất 160m2 (8x20). nhà 3 tầng rất kiên cố, nội thất ốp gỗ xịn. thiết kế đầy đủ công năng, 5pn, sân thượng rộng. ☎️ liên hệ xem nhà và làm việc chính chủ","mô tả vị trí cực đẹp lô góc 2 mặt tiền đường 10,5m vỉa hè 5m và 7,5m vỉa hè 4m, view sông cẩm lệ rất thoáng mát, 200m tới trục đường võ chí công, qua cầu nguyễn tri phương là vào trung tâm tp. khu vực đông dân cư, nhà ngay ngã 4 kinh doanh sầm uất, cơ sở hạ tầng hoàn thiện. rất thuận tiên kinh doanh hoặc mở trụ sở công ty. nhà hiện đang kinh doanh minimart và cửa hàng cafe, doanh thu ổn định. diện tích đất 160m2 (8 x 20). nhà 3 tầng rất kiên cố, nội thất ốp gỗ xịn. thiết kế đầy đủ công năng, 5pn, sân thượng rộng. liên hệ xem nhà và làm việc chính chủ"
77,"🏡 mô tả:🍀 nhà mới xây năm 2020 rất kiên cố, chắc chắn, thiết kế hiện đại, vật liệu xây dựng cao cấp, hệ cửa nhôm việt -ý. hệ thống nội thất gỗ sịn sò.🍀 nhà 4 tầng, mặt tiền đường 7,5m vỉa hè 3m.🍀 kết cấu có 4pn, 5wc, tất cả đều có wc trong phòng ngủ, phòng bếp, phòng thờ, phòng giặt, sân phơi.🍀 gần bệnh viện 600 giường, bãi tắm biển mỹ khê, sân bay...☎️ liên hệ: mr. chiến (chuyên bđs quận sơn trà - ngũ hành sơn).","mô tả nhà mới xây năm 2020 rất kiên cố, chắc chắn, thiết kế hiện đại, vật liệu xây dựng cao cấp, hệ cửa nhôm việt ý. hệ thống nội thất gỗ sịn sò. nhà 4 tầng, mặt tiền đường 7,5m vỉa hè 3m. kết cấu có 4pn, 5wc, tất cả đều có wc trong phòng ngủ, phòng bếp, phòng thờ, phòng giặt, sân phơi. gần bệnh viện 600 giường, bãi tắm biển mỹ khê, sân bay... liên hệ mr. chiến (chuyên bđs quận sơn trà ngũ hành sơn)."
78,"🌈 siêu phẩm nam việt á - nhà 4 tầng 90m2 - đường 7,5m - 6 pn thang máy- ngay công viên nam bùi tá hán, trường mầm non tuổi thân tiên, đh greenwich. - nhà 4 tầng 6 pn, 6 wc. - diện tích đất 90m, mặt tiền 5m, vuông vắn.- đường 7.5m vỉa hè 4m.  - nhà chủ tự xây, full nội thất, đầy đủ công năng. - có ô chờ để lắp đặt thêm thang máy.- khu dân trí cao, toàn nhà giàu, vài bước chân ra bờ sông mát mẻ. 🌈 liên hệ: mr. chiến (chuyên bđs quận sơn trà - ngũ hành sơn)","siêu phẩm nam việt á nhà 4 tầng 90m2 đường 7,5m 6 pn thang máy ngay công viên nam bùi tá hán, trường mầm non tuổi thân tiên, đh greenwich. nhà 4 tầng 6 pn, 6 wc. diện tích đất 90m, mặt tiền 5m, vuông vắn. đường 7.5m vỉa hè 4m. nhà chủ tự xây, full nội thất, đầy đủ công năng. có ô chờ để lắp đặt thêm thang máy. khu dân trí cao, toàn nhà giàu, vài bước chân ra bờ sông mát mẻ. liên hệ mr. chiến (chuyên bđs quận sơn trà ngũ hành sơn)"
79,"mô tả:+ vị trí: ngay trung tâm quận hải châu sầm uất nhất đà nẵng. tiện ích xung quanh không thiếu gì, giao thông thuận tiện, đi đâu cũng gần.+ gần sân bay, trường đại học duy tân, bv gia đình, quân khu 5, hoàn mỹ. 10 phút đến cầu rồng, cầu sông hàn, cầu tình yêu, biển mỹ khê.+ hiện trạng: nhà 3 tầng 2 mặt đường lớn thông tứ phía, rất thoáng.+ kết cấu gồm phòng khách, bếp, 4pn, 3wc, có chỗ đậu xe ô tô.","mô tả vị trí ngay trung tâm quận hải châu sầm uất nhất đà nẵng. tiện ích xung quanh không thiếu gì, giao thông thuận tiện, đi đâu cũng gần. gần sân bay, trường đại học duy tân, bv gia đình, quân khu 5, hoàn mỹ. 10 phút đến cầu rồng, cầu sông hàn, cầu tình yêu, biển mỹ khê. hiện trạng nhà 3 tầng 2 mặt đường lớn thông tứ phía, rất thoáng. kết cấu gồm phòng khách, bếp, 4pn, 3wc, có chỗ đậu xe ô tô."
80,"mô tả:+ vi trí ngay trung tâm quận hải châu, đầy đủ tiện ích, dân trí cao, gần nhiều trường học các cấp, cao đẳng, đại học.+ thiết kế: nhà 2 tầng mới, chắc chắn, đầy đủ nôi thất, 3pn, 2wc, khách, bếp, sân để xe, sân phơi… đầy đủ công năng.+ pháp lý chuẩn, sổ đẹp nở hậu tài lộc.liên hệ xem nhà và làm việc với chủ nhà","mô tả vi trí ngay trung tâm quận hải châu, đầy đủ tiện ích, dân trí cao, gần nhiều trường học các cấp, cao đẳng, đại học. thiết kế nhà 2 tầng mới, chắc chắn, đầy đủ nôi thất, 3pn, 2wc, khách, bếp, sân để xe, sân phơi... đầy đủ công năng. pháp lý chuẩn, sổ đẹp nở hậu tài lộc.liên hệ xem nhà và làm việc với chủ nhà"
81,"mô tả:+ vị trí ở khu nam việt á quận ngũ hành sơn toàn dân nhà giàu, cách bờ sông chỉ vài bước chân.+ mặt tiền đường 7,5m vỉa hè 3m.+ diện tích đất 90m2, khu phân lô quy hoạch rất đẹp.+ thiết kế 5pn, 4wc, khách, bếp, thờ, sân thượng và sân để xe rộng.liên hệ: mr. chiến (chuyên bđs khu vực sơn trà - ngũ hành sơn)","mô tả vị trí ở khu nam việt á quận ngũ hành sơn toàn dân nhà giàu, cách bờ sông chỉ vài bước chân. mặt tiền đường 7,5m vỉa hè 3m. diện tích đất 90m2, khu phân lô quy hoạch rất đẹp. thiết kế 5pn, 4wc, khách, bếp, thờ, sân thượng và sân để xe rộng.liên hệ mr. chiến (chuyên bđs khu vực sơn trà ngũ hành sơn)"
82,"+ vị trí trung tâm quận sơn trà, 5 phút đến cầu sông hàn, bãi tắm biển phạm văn đồng. 10 phút đến sân bay, chùa linh ứng.+ diện tích đất 90m2 ngang 5m. nhà 2 tầng 3pn, 2wc, phòng khách, bếp, sân để xe rộng rãi.+  nhà mặt tiền đường 7,5m vỉa hè 3m, khu dân cư đông, lượng khách du lịch nhiều. rất thuận tiện kinh doanh.+ đối diện là công viên, rất thoáng mát, an sinh đỉnh.","vị trí trung tâm quận sơn trà, 5 phút đến cầu sông hàn, bãi tắm biển phạm văn đồng. 10 phút đến sân bay, chùa linh ứng. diện tích đất 90m2 ngang 5m. nhà 2 tầng 3pn, 2wc, phòng khách, bếp, sân để xe rộng rãi. nhà mặt tiền đường 7,5m vỉa hè 3m, khu dân cư đông, lượng khách du lịch nhiều. rất thuận tiện kinh doanh. đối diện là công viên, rất thoáng mát, an sinh đỉnh."
83,"+ vị trí nhà ở trung tâm thành phố, tập trung đầy đủ các tiện ích đẳng cấp, an sinh bậc nhất đà nẵng.+ gần trường đại học kiến trúc, đại học đông á, bệnh viện mắt, bv gia đình, quân y, gần sân bay. + nhà 2 tầng, xây dựng rất chắc chắn. thiết kế đẹp, có 3pn.+ sổ vuông vức, pháp lý chuẩn. + chủ gấp bán nên giá còn thương lượng tốt.liên hệ: (gặp và làm việc với chủ nhà)","vị trí nhà ở trung tâm thành phố, tập trung đầy đủ các tiện ích đẳng cấp, an sinh bậc nhất đà nẵng. gần trường đại học kiến trúc, đại học đông á, bệnh viện mắt, bv gia đình, quân y, gần sân bay. nhà 2 tầng, xây dựng rất chắc chắn. thiết kế đẹp, có 3pn. sổ vuông vức, pháp lý chuẩn. chủ gấp bán nên giá còn thương lượng tốt.liên hệ (gặp và làm việc với chủ nhà)"
84,"+ nhà 2 tầng kiên cố, 3pn, 3wc.+ mặt tiền đường 30m vỉa hè 5m. thuộc khu dân cư nam cầu trần thị lý, phường mỹ an, quận ngũ hành sơn.+ vị trí đi bộ ra sông hàn mấy bước chân, cách biển mỹ khê 1km, 10 phút đến sân bay, gần trường học, gần chợ... + rất thuận tiện kinh doanh, văn phòng, công ty...liên hệ: (chuyên bđs dòng tiền tại đà nẵng)cam kết có bđs phù hợp","nhà 2 tầng kiên cố, 3pn, 3wc. mặt tiền đường 30m vỉa hè 5m. thuộc khu dân cư nam cầu trần thị lý, phường mỹ an, quận ngũ hành sơn. vị trí đi bộ ra sông hàn mấy bước chân, cách biển mỹ khê 1km, 10 phút đến sân bay, gần trường học, gần chợ... rất thuận tiện kinh doanh, văn phòng, công ty...liên hệ (chuyên bđs dòng tiền tại đà nẵng)cam kết có bđs phù hợp"
85,"🏡🏡🏡 nhà mặt tiền kd đỉnh - g.i.á đầu tư - đường hoài thanh - quận ngũ hành sơn💎💎💎 vị trí đắc địa, nằm trên trục đường hoài thanh rộng 7,5m vỉa hè 4m. đối diện trường đh kinh tế, 3 phút đi bộ ra đến sông hàn, cầu trần thị lý, nguyễn văn trỗi.⚡️⚡️⚡️ chỉ 10 phút tới bãi tắm biển mỹ khê bằng 2 trục đường nguyễn văn thoại và phan tứ.🍀🍀🍀 thiết kế: nhà 2 tầng, dt đất 80m2, mặt tiền 5m. khu phân lô bàn cờ. + tầng 1: phòng khách, bếp, ngủ, wc.+ tầng 2: 2pn, wc, phòng thờ, sân phơi.🔶🔶🔶 hiện đang cho t.h.u.ê mặt t.i.ề.n gần 20 t.r.i.ệ.u/tháng. ☎️☎️☎️ liên hệ mr.chiến (chuyên bđs dòng tiền tại đà nẵng)cam kết có bđs phù hợp với giá tốt nhất","nhà mặt tiền kd đỉnh g.i.á đầu tư đường hoài thanh quận ngũ hành sơn vị trí đắc địa, nằm trên trục đường hoài thanh rộng 7,5m vỉa hè 4m. đối diện trường đh kinh tế, 3 phút đi bộ ra đến sông hàn, cầu trần thị lý, nguyễn văn trỗi. chỉ 10 phút tới bãi tắm biển mỹ khê bằng 2 trục đường nguyễn văn thoại và phan tứ. thiết kế nhà 2 tầng, dt đất 80m2, mặt tiền 5m. khu phân lô bàn cờ. tầng 1 phòng khách, bếp, ngủ, wc. tầng 2 2pn, wc, phòng thờ, sân phơi. hiện đang cho t.h.u.ê mặt t.i.ề.n gần 20 t.r.i.ệ.u/tháng. liên hệ mr.chiến (chuyên bđs dòng tiền tại đà nẵng)cam kết có bđs phù hợp với giá tốt nhất"
86,"🏡🏡 siêu rẻ - chỉ 5 tỷ còn tl - nhà 2 tầng mặt phố an thượng - 200m ra bãi tắm mỹ khê📍📍vị trí cực đẹp, ngay khu phố khách du lịch tập trung đông nhất quận ngũ hành sơn - sơn trà, đà nẵng.🍀🍀 khu phố an sinh cực đỉnh, đầy đủ các tiện ích đẳng cấp.⚡️⚡️ hiện trạng là nhà 2 tầng, thiết kế hiện đại theo phong cách châu âu. tầng 1 cho thuê, tầng 2 có 2pn và wc để ở.💎💎 khu phố du lịch, cơ hội đầu tư hoặc kinh doanh rất tốt. (đang cho thuê mặt tiền 10tr/tháng).☎️☎️ liên hệ mr chiến: (chuyên bđs biển quận sơn trà - ngũ hành sơn)------ cam kết có bđs phù hợp ------","siêu rẻ chỉ 5 tỷ còn tl nhà 2 tầng mặt phố an thượng 200m ra bãi tắm mỹ khê vị trí cực đẹp, ngay khu phố khách du lịch tập trung đông nhất quận ngũ hành sơn sơn trà, đà nẵng. khu phố an sinh cực đỉnh, đầy đủ các tiện ích đẳng cấp. hiện trạng là nhà 2 tầng, thiết kế hiện đại theo phong cách châu âu. tầng 1 cho thuê, tầng 2 có 2pn và wc để ở. khu phố du lịch, cơ hội đầu tư hoặc kinh doanh rất tốt. (đang cho thuê mặt tiền 10tr/tháng). liên hệ mr chiến (chuyên bđs biển quận sơn trà ngũ hành sơn) cam kết có bđs phù hợp"
87,"+ bán toà khách sạn - căn hộ full nội thất cao cấp, có thang máy. dòng tiền ổn định đến 40triệu/tháng+ mặt tiền đường an thượng, khu phố khách du lịch tấp nập ngày đêm.+ chỉ cần 5 phút ra tới bãi tắm biển mỹ khê, 10 phút đến trung tâm tp, cầu rồng, cầu sông hàn, 15 phút đến sân bay.+ vị trí đắc địa, đẳng cấp, du lịch phát triển bậc nhất đà nẵng, gần trường đh kinh tế, tiện ích 5 sao.* liên hệ: mr. chiến (chuyên bđs dòng tiền đà nẵng)","bán toà khách sạn căn hộ full nội thất cao cấp, có thang máy. dòng tiền ổn định đến 40triệu/tháng mặt tiền đường an thượng, khu phố khách du lịch tấp nập ngày đêm. chỉ cần 5 phút ra tới bãi tắm biển mỹ khê, 10 phút đến trung tâm tp, cầu rồng, cầu sông hàn, 15 phút đến sân bay. vị trí đắc địa, đẳng cấp, du lịch phát triển bậc nhất đà nẵng, gần trường đh kinh tế, tiện ích 5 sao. * liên hệ mr. chiến (chuyên bđs dòng tiền đà nẵng)"
88,"📌mô tả: 📍📍nhà nằm trên trục đường 7,5m vỉa hè 4m tuyệt đẹp, kđt nam việt á. song song với đường chương dương, đối diện sông đô toả.🍀🍀 dt đất 90m2 ngang 5m, thiết kế 3 tầng 3pn khép kín, đầy đủ công năng, view sông cực mát.🥇🥇 đầy đủ nội thất cao cấp, dọn vào ở ngay.💎💎 khu dân trí cao, toàn nhà giàu, biệt thự.🏆🏆 nhiều tiện ích trong khu vực như chợ, siêu thị, trường học liên cấp, trường học quôcd tế, đh kinh tế, làng sinh viên...⚡️⚡️ khách mua có thể vừa ở vừa kinh doanh.------------------------☎️☎️ liên hệ mr.chiến (chuyên bđs dòng tiền tại đà nẵng)-------cam kết có bđs phù hợp với giá tốt nhất--------","mô tả nhà nằm trên trục đường 7,5m vỉa hè 4m tuyệt đẹp, kđt nam việt á. song song với đường chương dương, đối diện sông đô toả. dt đất 90m2 ngang 5m, thiết kế 3 tầng 3pn khép kín, đầy đủ công năng, view sông cực mát. đầy đủ nội thất cao cấp, dọn vào ở ngay. khu dân trí cao, toàn nhà giàu, biệt thự. nhiều tiện ích trong khu vực như chợ, siêu thị, trường học liên cấp, trường học quôcd tế, đh kinh tế, làng sinh viên... khách mua có thể vừa ở vừa kinh doanh. liên hệ mr.chiến (chuyên bđs dòng tiền tại đà nẵng) cam kết có bđs phù hợp với giá tốt nhất"
89,"👉nhà 3 tầng kiên cố. diện tích 100m2, đường 5,5m, lề 3m, vị trí đẹp tại hoà xuân, đà nẵng. 📍 cách đường phạm hùng và trường cấp 3 nguyễn văn thoại chỉ 50m. 📍 cách công viên lớn có hồ điều hoà, sân tập thể dục, khu vui chơi trẻ em hoà xuân 50m. 👉 công năng gồm: sân để xe, phòng khách, bếp, 3pn, 2 phòng sinh hoạt chung, phòng thờ, sân phơi, 2wc 👥 dân cư đông đúc, tri thức cao.☎️☎️ liên hệ mr.chiến (chuyên bđs dòng tiền tại đà nẵng)cam kết có bđs phù hợp với giá tốt nhất","nhà 3 tầng kiên cố. diện tích 100m2, đường 5,5m, lề 3m, vị trí đẹp tại hoà xuân, đà nẵng. cách đường phạm hùng và trường cấp 3 nguyễn văn thoại chỉ 50m. cách công viên lớn có hồ điều hoà, sân tập thể dục, khu vui chơi trẻ em hoà xuân 50m. công năng gồm sân để xe, phòng khách, bếp, 3pn, 2 phòng sinh hoạt chung, phòng thờ, sân phơi, 2wc dân cư đông đúc, tri thức cao. liên hệ mr.chiến (chuyên bđs dòng tiền tại đà nẵng)cam kết có bđs phù hợp với giá tốt nhất"
90,"📌mô tả: - nhà 3 tầng mới keng, thiết kế hiện đại.- diện tích đất 70m2, mặt tiền 6m.- mặt tiền đường 7,5m vỉa hè 3m.- khu dân cư đông đúc, buôn bán tấp nập.- tiện ích đầy đủ, gì cũng có.-----------------------------☎️liên hệ mr. chiến chuyên bđs khu vực quận thanh khê.","mô tả nhà 3 tầng mới keng, thiết kế hiện đại. diện tích đất 70m2, mặt tiền 6m. mặt tiền đường 7,5m vỉa hè 3m. khu dân cư đông đúc, buôn bán tấp nập. tiện ích đầy đủ, gì cũng có. liên hệ mr. chiến chuyên bđs khu vực quận thanh khê."
91,"📌 mô tả:💎💎 vị trí triệu đô, ngay chợ hà thân, gần chợ đêm, giữa cầu sông hàn với cầu rồng. vài bước chân ra cầu tình yêu.👉👉 khu này mua vừa ở vừa kinh doanh buôn bán rất tốt.💵💵 đặc biệt mua kinh doanh khách sạn, apartment thì tuyệt vời vì xung quanh toàn các địa điểm du lịch lớn, nổi tiếng.🍀🍀 khu trung tâm du lịch nên được quy hoạch rất đẹp, tiện ích 5 sao. 🌎🌎 chỉ cần 5 phút ra tới biển, 10 phút ra đến sân bay.🔹🔹 bán đất tặng nhà cấp 4 cũ.☎️☎️ liên hệ mr.chiến (chuyên bđs dòng tiền tại đà nẵng)cam kết có bđs phù hợp với giá tốt nhất","mô tả vị trí triệu đô, ngay chợ hà thân, gần chợ đêm, giữa cầu sông hàn với cầu rồng. vài bước chân ra cầu tình yêu. khu này mua vừa ở vừa kinh doanh buôn bán rất tốt. đặc biệt mua kinh doanh khách sạn, apartment thì tuyệt vời vì xung quanh toàn các địa điểm du lịch lớn, nổi tiếng. khu trung tâm du lịch nên được quy hoạch rất đẹp, tiện ích 5 sao. chỉ cần 5 phút ra tới biển, 10 phút ra đến sân bay. bán đất tặng nhà cấp 4 cũ. liên hệ mr.chiến (chuyên bđs dòng tiền tại đà nẵng)cam kết có bđs phù hợp với giá tốt nhất"
92,"nhà đẹp có hồ bơi đường lê duẩn, trung tâm- nhà mới xây 3 tầng rất xinh- diện tích 80m, hướng tây- 3 ngủ, 4wc, 1 thờ, sân xe, giặc phơi- kiệt 2,5m cách đường chỉ 40m- tặng kèm nội thất vô ở liềnchính chủ bán quý khách xem mua xin liên hệ qua số điện thoạigiá 4,850 tỷ thương lượng","nhà đẹp có hồ bơi đường lê duẩn, trung tâm nhà mới xây 3 tầng rất xinh diện tích 80m, hướng tây 3 ngủ, 4wc, 1 thờ, sân xe, giặc phơi kiệt 2,5m cách đường chỉ 40m tặng kèm nội thất vô ở liềnchính chủ bán quý khách xem mua xin liên hệ qua số điện thoạigiá 4,850 tỷ thương lượng"
93,"bán nhà mặt tiền hải châu, đường hải sơn hải hồ, gần chợ đống đa 👉 #giá_rẻ- diện tích 55m x 3 tầng- hướng tây bắc, kinh doanh buôn bán ok- mặt tiền kẹp kiệt thông thoáng- 4 phòng ngủ, 4wc, sân chill- tặng nội thất đẹp vô ở liềnchính chủ bán quý khách có nhu cầu xem và mua thì liên hệ vào số điện thoại","bán nhà mặt tiền hải châu, đường hải sơn hải hồ, gần chợ đống đa giá rẻ diện tích 55m x 3 tầng hướng tây bắc, kinh doanh buôn bán ok mặt tiền kẹp kiệt thông thoáng 4 phòng ngủ, 4wc, sân chill tặng nội thất đẹp vô ở liềnchính chủ bán quý khách có nhu cầu xem và mua thì liên hệ vào số điện thoại"
94,"bán nhà 3 tầng đẹp đường bùi thiện ngộ, gần võ chí công & bùi trang chước 👉 tt 3 tỷ- đường 7m5 + lề 4m mỗi bên- diện tích 100m (5 x 20), hướng tây nam- có gara ô tô, có ngủ dưới cho người già- 4 ngủ, 4wc, thờ, giặc phơi- tặng nội thất vô ở liền, vị trí đẹptrả trước 3 tỷ lấy nhà, còn 1 ít cho góp ngân hàng 25 năm. chính chủ bán rẻ quý khách xem nhà mua nhà vui lòng gọi vào số điện thoại","bán nhà 3 tầng đẹp đường bùi thiện ngộ, gần võ chí công bùi trang chước tt 3 tỷ đường 7m5 lề 4m mỗi bên diện tích 100m (5 x 20), hướng tây nam có gara ô tô, có ngủ dưới cho người già 4 ngủ, 4wc, thờ, giặc phơi tặng nội thất vô ở liền, vị trí đẹptrả trước 3 tỷ lấy nhà, còn 1 ít cho góp ngân hàng 25 năm. chính chủ bán rẻ quý khách xem nhà mua nhà vui lòng gọi vào số điện thoại"
