,Mô tả,text_cleaned
23,"bán nhà đường mai lão bạng, phường thuận phước, quận hải châu, đà nẵng+ diện tích: 92.5m2 (7.8m x 12m). hướng nam mát mẻ. đường 5m5.+ kết cấu nhà 4 tầng xây kiểu mini vila. nội thất nhà toàn bằng gỗ, hiện đại và còn mới, có thể dọn vào ở ngay, để lại toàn bộ nội thất.-tầng 1 kinh doanh quán cafe rộng rãi (01 toilet và bếp rộng)-tầng 2 có 2 phòng ngủ và nơi để thư giãn (02 toilet)-tầng 3 có 1 phòng ngủ lớn, có thể cải tạo thành 2 phòng ngủ tùy thích và có nơi để thư giãn (01 toilet lớn để máy giặt, máy sấy)-tầng 4 rộng rãi xây kiểu mái thái, có phòng thờ.+ vị trí: gần chợ đống đa, gần vinmart, trường học… khu an ninh cực cao giá bán: 6.6 tỷlh em để xem thực tế và làm việc chính chủ: 0972.884.10năm (ngọc linh)","bán nhà đường mai lão bạng, phường thuận phước, quận hải châu, đà nẵng diện tích 92.5m2 (7.8m x 12m). hướng nam mát mẻ. đường 5m5. kết cấu nhà 4 tầng xây kiểu mini vila. nội thất nhà toàn bằng gỗ, hiện đại và còn mới, có thể dọn vào ở ngay, để lại toàn bộ nội thất. tầng 1 kinh doanh quán cafe rộng rãi (01 toilet và bếp rộng) tầng 2 có 2 phòng ngủ và nơi để thư giãn (02 toilet) tầng 3 có 1 phòng ngủ lớn, có thể cải tạo thành 2 phòng ngủ tùy thích và có nơi để thư giãn (01 toilet lớn để máy giặt, máy sấy) tầng 4 rộng rãi xây kiểu mái thái, có phòng thờ. vị trí gần chợ đống đa, gần vinmart, trường học... khu an ninh cực cao giá bán 6.6 tỷlh em để xem thực tế và làm việc chính chủ 0972.884.10năm (ngọc linh)"
24,"bán nhà đường bình thái 1, phường hòa thọ đông, quận cẩm lệ, đà nẵng+ diện tích: 138m2 (5.8m x 20m). hướng nam. đường 5m5, lề 1m+ kết cấu nhà 2 tầng đầy đủ công năng phục vụ sinh hoạt gia đình.+ vị trí: gần ông ích đường. thích hợp vừa ở vừa kinh doanh.giá bán: 5.3 tỷlh em để xem thực tế và làm việc chính chủ: 0972.884.10năm (ngọc linh)","bán nhà đường bình thái 1, phường hòa thọ đông, quận cẩm lệ, đà nẵng diện tích 138m2 (5.8m x 20m). hướng nam. đường 5m5, lề 1m kết cấu nhà 2 tầng đầy đủ công năng phục vụ sinh hoạt gia đình. vị trí gần ông ích đường. thích hợp vừa ở vừa kinh doanh.giá bán 5.3 tỷlh em để xem thực tế và làm việc chính chủ 0972.884.10năm (ngọc linh)"
25,"bán nhà đường lương nhữ hộc, phường hòa cường nam, quận hải châu, đà nẵng.dt: 95m2 (5x19). hướng đông. đường 7m5, vỉa hè 4m.nhà 3 tầng, 3pn, 2wc. đang kinh doanh tốt, đối diện trường đh ngoại ngữ, trường cấp 3, cấp 2,...gần xô viết nghệ tĩnh, phan đăng lưu,...thích hợp vừa ở vừa kinh doanh hoặc cho thuê giá cao.giá bán chính chủ: 8.5 tỷliên hệ em để xem nhà và gặp chủ thương lượng: 0972.884.10năm (linh)","bán nhà đường lương nhữ hộc, phường hòa cường nam, quận hải châu, đà nẵng.dt 95m2 (5 x 19). hướng đông. đường 7m5, vỉa hè 4m.nhà 3 tầng, 3pn, 2wc. đang kinh doanh tốt, đối diện trường đh ngoại ngữ, trường cấp 3, cấp 2,...gần xô viết nghệ tĩnh, phan đăng lưu,...thích hợp vừa ở vừa kinh doanh hoặc cho thuê giá cao.giá bán chính chủ 8.5 tỷliên hệ em để xem nhà và gặp chủ thương lượng 0972.884.10năm (linh)"
26,"bán đất biệt thự đường bùi tá hán, phường khuê mỹ, quận ngũ hành sơn, đà nẵng.+ dt: 250m2 (10x25). hướng tây bắc, đường 15m.+ vị trí: gần đường đoàn khuê, nghiêm xuân yêm,…+ gía bán: 14 tỷ liên hệ em dẫn đi xem và gặp chủ thương lượng","bán đất biệt thự đường bùi tá hán, phường khuê mỹ, quận ngũ hành sơn, đà nẵng. dt 250m2 (10 x 25). hướng tây bắc, đường 15m. vị trí gần đường đoàn khuê, nghiêm xuân yêm,... gía bán 14 tỷ liên hệ em dẫn đi xem và gặp chủ thương lượng"
27,"bán đất đường bùi tá hán, phường khuê mỹ, quận ngũ hành sơn, đà nẵng.+ diện tích: 115m² (5m x 23m). đường: 15m vỉa hè: 5m+ hướng: bắc+ khu vực đường lớn dân cư cao cấp thuận tiện vừa ở vừa kinh doanh.+ gía bán: 8,4 tỷ liên hệ em dẫn đi xem và gặp chủ thương lượng: 0972.884.10năm (linh)","bán đất đường bùi tá hán, phường khuê mỹ, quận ngũ hành sơn, đà nẵng. diện tích 115m2 (5m x 23m). đường 15m vỉa hè 5m hướng bắc khu vực đường lớn dân cư cao cấp thuận tiện vừa ở vừa kinh doanh. gía bán 8,4 tỷ liên hệ em dẫn đi xem và gặp chủ thương lượng 0972.884.10năm (linh)"
28,"bán nhà đường lê thanh nghị, phường hòa cường nam, quận hải châu, đà nẵng.+ dt: 130m2 (5x26). đường 10m5, vỉa hè 4m. hướng đông.+ nhà 3 tầng. tầng 1 trống suốt tiện kinh doanh, làm văn phòng. tầng 2 gồm 3 phòng ngủ, 3 wc. tầng 3 gồm phòng thờ, phòng kho, khu giặt phơi đồ.+ khu kinh doanh sầm uất, gần phan đăng lưu, xô viết nghệ tĩnh.+ gía bán: 14 tỷ liên hệ em dẫn đi xem và gặp chủ thương lượng: 0972.884.10năm (linh)","bán nhà đường lê thanh nghị, phường hòa cường nam, quận hải châu, đà nẵng. dt 130m2 (5 x 26). đường 10m5, vỉa hè 4m. hướng đông. nhà 3 tầng. tầng 1 trống suốt tiện kinh doanh, làm văn phòng. tầng 2 gồm 3 phòng ngủ, 3 wc. tầng 3 gồm phòng thờ, phòng kho, khu giặt phơi đồ. khu kinh doanh sầm uất, gần phan đăng lưu, xô viết nghệ tĩnh. gía bán 14 tỷ liên hệ em dẫn đi xem và gặp chủ thương lượng 0972.884.10năm (linh)"
29,"bán nhà đường đống đa, phường thuận phước, quận hải châu, đà nẵng.+ dt: 47,5m2 (4.3m x 11.3m). còn 1 phần đường luồng bên hông nhà thêm 0,37m chưa vào sổ. đường 15m. vỉa hè 4m. hướng đông nam.+ nhà 3.5 tầng gồm 3 phòng ngủ.+ vị trí gần các đường lý thường kiệt, lương ngọc quyến, nguyễn du, bạch đằng, sông hàn,…+ gía bán: 10 tỷ liên hệ em dẫn đi xem và gặp chủ thương lượng: 0972.884.10năm (linh)","bán nhà đường đống đa, phường thuận phước, quận hải châu, đà nẵng. dt 47,5m2 (4.3m x 11.3m). còn 1 phần đường luồng bên hông nhà thêm 0,37m chưa vào sổ. đường 15m. vỉa hè 4m. hướng đông nam. nhà 3.5 tầng gồm 3 phòng ngủ. vị trí gần các đường lý thường kiệt, lương ngọc quyến, nguyễn du, bạch đằng, sông hàn,... gía bán 10 tỷ liên hệ em dẫn đi xem và gặp chủ thương lượng 0972.884.10năm (linh)"
30,"bán nhà đường tiểu la, phường hòa cường bắc, hải châu, đà nẵng+ dt: 80m2 (5x16). hướng bắc. đường 10m5, vỉa hè 4m.+ nhà 3 mê đẹp gồm 4 phòng ngủ, 3wc,..+ gần ngay sân bóng đá chuyên viên. thích hợp ở và kinh doanh buô bán hoặc cho thuê.+ giá bán chính chủ: 13 tỷ.lh em dẫn đi xem và gặp chủ thương lượng: 097288410năm   (linh)","bán nhà đường tiểu la, phường hòa cường bắc, hải châu, đà nẵng dt 80m2 (5 x 16). hướng bắc. đường 10m5, vỉa hè 4m. nhà 3 mê đẹp gồm 4 phòng ngủ, 3wc,.. gần ngay sân bóng đá chuyên viên. thích hợp ở và kinh doanh buô bán hoặc cho thuê. giá bán chính chủ 13 tỷ.lh em dẫn đi xem và gặp chủ thương lượng 097288410năm (linh)"
31,"bán nhà đường cao sơn pháo, phường hòa an, quận cẩm lệ, đà nẵng.+ dt: 180m2 (10x18). hướng đông nam. đường 7m5, vỉa hè 4m5.+ nhà 3 tầng kiên cố, 2 lô liền kề, mặt bằng tầng trệt rộng rãi thuận tiện mở văn phòng công ty và các dịch vụ kinh doanh đa dạng nghành nghề...v.w+ vị trí nhà : nằm ngay trên trục đường thông ra cổng bến xe trung tâm thành phố & yên thế - bắc sơn. + giá bán chính chủ: 12.5 tỷ tllh em dẫn đi xem và gặp chủ thương lượng: 097288410năm   (linh)","bán nhà đường cao sơn pháo, phường hòa an, quận cẩm lệ, đà nẵng. dt 180m2 (10 x 18). hướng đông nam. đường 7m5, vỉa hè 4m5. nhà 3 tầng kiên cố, 2 lô liền kề, mặt bằng tầng trệt rộng rãi thuận tiện mở văn phòng công ty và các dịch vụ kinh doanh đa dạng nghành nghề...v.w vị trí nhà nằm ngay trên trục đường thông ra cổng bến xe trung tâm thành phố yên thế bắc sơn. giá bán chính chủ 12.5 tỷ tllh em dẫn đi xem và gặp chủ thương lượng 097288410năm (linh)"
32,"bán khách sạn đường phan liêm, phường mỹ an, quận ngũ hành sơn, đà nẵng.+ diện tích: 90m2 (4,5 x 20m). dtsd: 600m2. hướng nam. đường 5m5, vỉa hè 3m.+ khách sạn tiêu chuẩn 2 sao, đang hoạt động tốt gồm: 1 trệt, 6 lầu, sân thượng, thang máy.+ khách sạn sạch sẽ đang kinh doanh ổn định với 18 phòng. vị trí kinh doanh thuận lợi, gần bãi biển mỹ khê.+ giá bán đến chính chủ: 19.5 tỷ (tlcc)liên hệ em để xem nhà và làm việc chính chủ: 0972.884.10năm (linh)","bán khách sạn đường phan liêm, phường mỹ an, quận ngũ hành sơn, đà nẵng. diện tích 90m2 (4,5 x 20m). dtsd 600m2. hướng nam. đường 5m5, vỉa hè 3m. khách sạn tiêu chuẩn 2 sao, đang hoạt động tốt gồm 1 trệt, 6 lầu, sân thượng, thang máy. khách sạn sạch sẽ đang kinh doanh ổn định với 18 phòng. vị trí kinh doanh thuận lợi, gần bãi biển mỹ khê. giá bán đến chính chủ 19.5 tỷ (tlcc)liên hệ em để xem nhà và làm việc chính chủ 0972.884.10năm (linh)"
33,"bán khách sạn đường cách mạng tháng 8, phường khuê trung, quận cẩm lệ, đà nẵng.+ dt: 125m2 (5x25). hướng đông nam. đường lớn 22m, vỉa hè 4m.+ khách sạn 4 tầng, 12 phòng ngủ, 1 phòng lễ tân, 1 phòng sinh hoạt chung.+ đối diện trung tâm báo chí quốc tế apec, bên cạnh sân golf, bệnh viện tâm trí.+ giá bán: 11,5 tỷ (tlcc)liên hệ em để xem nhà : linh","bán khách sạn đường cách mạng tháng 8, phường khuê trung, quận cẩm lệ, đà nẵng. dt 125m2 (5 x 25). hướng đông nam. đường lớn 22m, vỉa hè 4m. khách sạn 4 tầng, 12 phòng ngủ, 1 phòng lễ tân, 1 phòng sinh hoạt chung. đối diện trung tâm báo chí quốc tế apec, bên cạnh sân golf, bệnh viện tâm trí. giá bán 11,5 tỷ (tlcc)liên hệ em để xem nhà linh"
34,"bán nhà đường dương thưởng, phường hòa cường bắc, quận hải châu, đà nẵng.+ dt: 72,6m2 (5,3m x 15m). hướng nam mát mẻ. đường 5m5, vỉa hè 3m.+ nhà 3,5 tầng, 5 phòng ngủ, 3wc, 1 phòng thờ, 1 sân cây cảnh, 1 phòng giặt, sân phơi, nhà đã lắp đặt máy nước nóng năng lượng mặt trời rất tiết kiệm điện.+ nhà trung tâm quận hải châu, p.hoà cường bắc. gần cầu trần thị lý , cách chợ hoà cường 150m, công viên vui chơi trẻ em 100m, gần trường học cấp 1,2,3+ khu dân trí cao, xung quanh là khu vực nhà ở của cán bộ hưu trí công an và quân đội, an ninh tốt thích hợp để ở lâu dài.+ giá bán đến chính chủ: 6.85 tỷ (tlcc)liên hệ em để xem nhà và làm việc chính chủ: 0972.884.10năm (linh)","bán nhà đường dương thưởng, phường hòa cường bắc, quận hải châu, đà nẵng. dt 72,6m2 (5,3m x 15m). hướng nam mát mẻ. đường 5m5, vỉa hè 3m. nhà 3,5 tầng, 5 phòng ngủ, 3wc, 1 phòng thờ, 1 sân cây cảnh, 1 phòng giặt, sân phơi, nhà đã lắp đặt máy nước nóng năng lượng mặt trời rất tiết kiệm điện. nhà trung tâm quận hải châu, p.hoà cường bắc. gần cầu trần thị lý , cách chợ hoà cường 150m, công viên vui chơi trẻ em 100m, gần trường học cấp 1,2,3 khu dân trí cao, xung quanh là khu vực nhà ở của cán bộ hưu trí công an và quân đội, an ninh tốt thích hợp để ở lâu dài. giá bán đến chính chủ 6.85 tỷ (tlcc)liên hệ em để xem nhà và làm việc chính chủ 0972.884.10năm (linh)"
35,"bán nhà đường cách mạng tháng 8, phường khuê trung, quận cẩm lệ, đà nẵng.+ dt: 80m2 (8.55 x 9.3). hướng đông nam. đường rộng 2 làn, mỗi làn 15m. lề 5m.+ công năng: 2 tầng cũ, 2 phòng ngủ, 2 wc, bếp, phòng thờ, phòng khách, có phòng giặt đồ và sân phơi đồ riêng.+ vị trí: đường cách mạng tháng 8, phường khuê trung, khu vực kinh doanh sầm uất, an ninh, dân trí cao, bán kính 500m gần trường mẫu giáo, trường cấp 1, 2, 3, chợ cẩm lệ, bệnh viện, gần trung tâm hành chính quận cẩm lệ, công an quận.+ giá bán chính chủ: 7 tỷ (tlcc)liên hệ em để xem nhà và làm việc chính chủ: 0972.884.10năm (linh)","bán nhà đường cách mạng tháng 8, phường khuê trung, quận cẩm lệ, đà nẵng. dt 80m2 (8.55 x 9.3). hướng đông nam. đường rộng 2 làn, mỗi làn 15m. lề 5m. công năng 2 tầng cũ, 2 phòng ngủ, 2 wc, bếp, phòng thờ, phòng khách, có phòng giặt đồ và sân phơi đồ riêng. vị trí đường cách mạng tháng 8, phường khuê trung, khu vực kinh doanh sầm uất, an ninh, dân trí cao, bán kính 500m gần trường mẫu giáo, trường cấp 1, 2, 3, chợ cẩm lệ, bệnh viện, gần trung tâm hành chính quận cẩm lệ, công an quận. giá bán chính chủ 7 tỷ (tlcc)liên hệ em để xem nhà và làm việc chính chủ 0972.884.10năm (linh)"
36,"bán nhà đường hải phòng, phường chính gián, quận thanh khê, đà nẵng.+ dt: 120,3m2 ( 4,9m x17,5m + nở hậu). kẹp kiệt 3m bên hông. hướng tây nam. đường 10m5, vỉa hè 3m5.+ nhà 7 tầng thang máy, 2 mặt tiền, 18 phòng ngủ khép kín.+ căn nhà rất thông thoáng và nhiều ánh sáng. vị trí trung tâm thành phố, gần siêu thị nguyễn kim, gần công viên 29/3, sân bay, nhà ga, khu dân cư đông đúc…rất phù hợp vừa sử dụng để ở , vừa kết hợp làm các dịch vụ về giáo dục, y khoa, phòng gym, spa, siêu thị, văn phòng cho thuê, kho hàng …+ giá chính chủ: 14 tỷ lh em để xem nhà và làm việc chính chủ: 0972.884.10năm (linh)","bán nhà đường hải phòng, phường chính gián, quận thanh khê, đà nẵng. dt 120,3m2 ( 4,9m x17,5m nở hậu). kẹp kiệt 3m bên hông. hướng tây nam. đường 10m5, vỉa hè 3m5. nhà 7 tầng thang máy, 2 mặt tiền, 18 phòng ngủ khép kín. căn nhà rất thông thoáng và nhiều ánh sáng. vị trí trung tâm thành phố, gần siêu thị nguyễn kim, gần công viên 29/3, sân bay, nhà ga, khu dân cư đông đúc...rất phù hợp vừa sử dụng để ở , vừa kết hợp làm các dịch vụ về giáo dục, y khoa, phòng gym, spa, siêu thị, văn phòng cho thuê, kho hàng ... giá chính chủ 14 tỷ lh em để xem nhà và làm việc chính chủ 0972.884.10năm (linh)"
37,"chủ xuất ngoại cần chuyển nhượng gấp trường mầm non tâm huyết.+ dt: 550m2 (33m x 18m). đường 7m5, vỉa hè 4m5.+ chỉ ưu tiên cho khách hàng mua tiếp tục duy trì hoạt động của trường mầm non.+ doanh thu ổn định. vị trí khu an ninh tốt, gần trường liên cấp việt nhật. + giá bán: 34 tỷlh em để xem nhà và làm việc:linh","chủ xuất ngoại cần chuyển nhượng gấp trường mầm non tâm huyết. dt 550m2 (33m x 18m). đường 7m5, vỉa hè 4m5. chỉ ưu tiên cho khách hàng mua tiếp tục duy trì hoạt động của trường mầm non. doanh thu ổn định. vị trí khu an ninh tốt, gần trường liên cấp việt nhật. giá bán 34 tỷlh em để xem nhà và làm việc linh"
38,"bán tòa căn hộ đường dương đình nghệ, phường an hải bắc, sơn trà, đà nẵng+ dt: 105m2. ngang 5m, dài 21m. hướng nam. đường 7,5m. vỉa hè 4m.+ kết cấu tòa nhà 6 tầng, 18 căn hộ, tầng 1 để xe, có thang máy. giá phòng cho thuê cao từ 3,5tr – 4tr/tháng.+ vị trí: nhà nằm giữa đường dương đình nghệ, khu vực sầm uất, nhiều khách sạn và nhà hàng, khu vực khách du lịch và người nước ngoài nhiều. cách biển 300m, cách cầu sông hàn 300m. song song đường phạm văn đồng. + giá bán đến công chứng: 16,5 tỷ (tl)liên hệ em để xem nhà và làm việc chính chủ: 0972.884.10năm (linh)","bán tòa căn hộ đường dương đình nghệ, phường an hải bắc, sơn trà, đà nẵng dt 105m2. ngang 5m, dài 21m. hướng nam. đường 7,5m. vỉa hè 4m. kết cấu tòa nhà 6 tầng, 18 căn hộ, tầng 1 để xe, có thang máy. giá phòng cho thuê cao từ 3,5tr 4tr/tháng. vị trí nhà nằm giữa đường dương đình nghệ, khu vực sầm uất, nhiều khách sạn và nhà hàng, khu vực khách du lịch và người nước ngoài nhiều. cách biển 300m, cách cầu sông hàn 300m. song song đường phạm văn đồng. giá bán đến công chứng 16,5 tỷ (tl)liên hệ em để xem nhà và làm việc chính chủ 0972.884.10năm (linh)"
39,"bán đất đường lê đình lý, phường hòa thuận tây, quận hải châu, đà nẵng.dt: 83m2 (4.3x19). hướng đông nam. đường 15m, vỉa hè 4m.lô đất trống đẹp.gần đầu đường nguyễn hữu thọ, nguyễn tri phương, duy tân,...+ giá bán chính chủ: 16 tỷ (tlcc)liên hệ em để xem nhà và làm việc chính chủ: 0972.884.10năm (linh)","bán đất đường lê đình lý, phường hòa thuận tây, quận hải châu, đà nẵng.dt 83m2 (4.3 x 19). hướng đông nam. đường 15m, vỉa hè 4m.lô đất trống đẹp.gần đầu đường nguyễn hữu thọ, nguyễn tri phương, duy tân,... giá bán chính chủ 16 tỷ (tlcc)liên hệ em để xem nhà và làm việc chính chủ 0972.884.10năm (linh)"
40,"bán nhà đường an cư 3, phường an hải bắc, quận sơn trà, đà nẵng.dt: 96,6m2 (6x17). hướng tây + bắc. nhà 3 tầng, 3pn - 5wc - 1 gara ôtô + 1 phòng thờ.cách bãi biển phước mỹ 300m. gần hồ nghinh, dương đình nghệ, phạm văn đồng, võ nguyên giáp.giá bán chính chủ: 11 tỷliên hệ em để xem nhà và làm việc chính chủ: 0972.884.10năm (linh)","bán nhà đường an cư 3, phường an hải bắc, quận sơn trà, đà nẵng.dt 96,6m2 (6 x 17). hướng tây bắc. nhà 3 tầng, 3pn 5wc 1 gara ôtô 1 phòng thờ.cách bãi biển phước mỹ 300m. gần hồ nghinh, dương đình nghệ, phạm văn đồng, võ nguyên giáp.giá bán chính chủ 11 tỷliên hệ em để xem nhà và làm việc chính chủ 0972.884.10năm (linh)"
41,"bán nhà đường nguyễn trác, phường hòa thuận tây, quận hải châu, đà nẵng.+ diện tích 133m² (5m x 26,7m). kết cấu nhà 2 tầng 3 phòng ngủ (có pn dưới), 3wc.+ vị trí đẹp đắc địa đối diện công viên, khu vực an ninh, dân trí cao, đa tiện ích, thích hợp kh mua để ở, đầu tư hoặc kinh doanh. gia đình thiện chí bán nhanh giá rẻ.+ giá: 8 tỷ 500 triệuliên hệ em dẫn đi xem và làm việc chính chủ: 0972.884.10năm (ngọc linh)","bán nhà đường nguyễn trác, phường hòa thuận tây, quận hải châu, đà nẵng. diện tích 133m2 (5m x 26,7m). kết cấu nhà 2 tầng 3 phòng ngủ (có pn dưới), 3wc. vị trí đẹp đắc địa đối diện công viên, khu vực an ninh, dân trí cao, đa tiện ích, thích hợp kh mua để ở, đầu tư hoặc kinh doanh. gia đình thiện chí bán nhanh giá rẻ. giá 8 tỷ 500 triệuliên hệ em dẫn đi xem và làm việc chính chủ 0972.884.10năm (ngọc linh)"
42,"bán khách sạn đường nguyễn văn thoại, phường mỹ an, quận ngũ hành sơn, đà nẵng+ pháp lý sạch, sang tên nhanh chóng.+ diện tích: 103,5m2 (4,5m x 23m).+ tòa khách sạn 8 tầng thang máy, tổng 21 phòng cho thuê, dòng tiền hơn 100tr/tháng.+ đường 20m, ô tô 45 chỗ dừng đỗ ngày đêm.+ vị trí cực đẹp, đi bộ ra biển vài phút. cách biển 200m, khu vực sầm uất. vị trí cực hiếm giá cực rẻ. ngay sát khu vực phố tây, khách thuê luôn kín phòng. xung quanh là các tòa khách sạn, nhà hàng kinh doanh sầm uất.+ giá bán chính chủ: 25 tỷ.liên hệ em dẫn đi xem nhà (ngọc linh)","bán khách sạn đường nguyễn văn thoại, phường mỹ an, quận ngũ hành sơn, đà nẵng pháp lý sạch, sang tên nhanh chóng. diện tích 103,5m2 (4,5m x 23m). tòa khách sạn 8 tầng thang máy, tổng 21 phòng cho thuê, dòng tiền hơn 100tr/tháng. đường 20m, ô tô 45 chỗ dừng đỗ ngày đêm. vị trí cực đẹp, đi bộ ra biển vài phút. cách biển 200m, khu vực sầm uất. vị trí cực hiếm giá cực rẻ. ngay sát khu vực phố tây, khách thuê luôn kín phòng. xung quanh là các tòa khách sạn, nhà hàng kinh doanh sầm uất. giá bán chính chủ 25 tỷ.liên hệ em dẫn đi xem nhà (ngọc linh)"
43,"bán nhà đường ngô thị liễu, phường hòa cường bắc, quận hải châu, đà nẵng.+ dt: 82.5m2 (5m x 16.5m). hướng chính đông. đường 5m5, lề 3m+ kết cấu nhà 3 tầng gồm 3 phòng ngủ, 3 wc,+ vị trí: khu phố yên tĩnh, an ninh, ngay sau đồn công an phường, sát hàn thuyên.giá bán chính chủ: 6 tỷ tl.liên hệ em dẫn đi xem nhà và gặp chủ thương lượng: 0972.884.10năm (ngọc linh)","bán nhà đường ngô thị liễu, phường hòa cường bắc, quận hải châu, đà nẵng. dt 82.5m2 (5m x 16.5m). hướng chính đông. đường 5m5, lề 3m kết cấu nhà 3 tầng gồm 3 phòng ngủ, 3 wc, vị trí khu phố yên tĩnh, an ninh, ngay sau đồn công an phường, sát hàn thuyên.giá bán chính chủ 6 tỷ tl.liên hệ em dẫn đi xem nhà và gặp chủ thương lượng 0972.884.10năm (ngọc linh)"
44,"bán nhà đường thạch lam, phường phước mỹ, quận sơn trà, đà nẵng.+ dt: 81m2 (5x16). hướng đông bắc. đường 5m.+ vị trí: cách biển 300 mét cách sân bay trung tâm 3km cách đường nguyễn văn thoại 150 mét+ tiện ích: vị trí trung tâm du lịch không thiếu tiện ích gì hết gần trường, chợ, ngân hàng+ cần tiền đi định cư nước ngoài mới phải bán căn nhà tâm huyết. sổ hồng đã hoàn công sẵn công chứng ngay.giá bán chính chủ: 6.3 tỷ tl.liên hệ em dẫn đi xem nhà và gặp chủ thương lượng: 0972.884.10năm (ngọc linh)","bán nhà đường thạch lam, phường phước mỹ, quận sơn trà, đà nẵng. dt 81m2 (5 x 16). hướng đông bắc. đường 5m. vị trí cách biển 300 mét cách sân bay trung tâm 3km cách đường nguyễn văn thoại 150 mét tiện ích vị trí trung tâm du lịch không thiếu tiện ích gì hết gần trường, chợ, ngân hàng cần tiền đi định cư nước ngoài mới phải bán căn nhà tâm huyết. sổ hồng đã hoàn công sẵn công chứng ngay.giá bán chính chủ 6.3 tỷ tl.liên hệ em dẫn đi xem nhà và gặp chủ thương lượng 0972.884.10năm (ngọc linh)"
45,"bán nhà mặt tiền đường kỳ đồng, phường xuân hà, quận thanh khê, đà nẵng.+ dt: 103m2 (5x20.5). hướng bắc. đường 7m5, lề 5m.+ kết cấu nhà trước 2 tầng đang cho thuê kinh doanh cà phê, phía sau là phòng trọ cấp 4 có 2 phòng ở phía sau đường kiệt 4m.+ vị trí: nằm ở vị trí khu dân cư đông đúc, gần hà huy tập, cách chợ kỳ đồng 200m, nhiều trường học, tiện ích xung quanh. vị trí thích hợp để cho thuê kiếm thu nhập hàng tháng.giá bán chính chủ: 6.5 tỷ tl.liên hệ em dẫn đi xem nhà và gặp chủ thương lượng: 0972.884.10năm (ngọc linh)","bán nhà mặt tiền đường kỳ đồng, phường xuân hà, quận thanh khê, đà nẵng. dt 103m2 (5 x 20.5). hướng bắc. đường 7m5, lề 5m. kết cấu nhà trước 2 tầng đang cho thuê kinh doanh cà phê, phía sau là phòng trọ cấp 4 có 2 phòng ở phía sau đường kiệt 4m. vị trí nằm ở vị trí khu dân cư đông đúc, gần hà huy tập, cách chợ kỳ đồng 200m, nhiều trường học, tiện ích xung quanh. vị trí thích hợp để cho thuê kiếm thu nhập hàng tháng.giá bán chính chủ 6.5 tỷ tl.liên hệ em dẫn đi xem nhà và gặp chủ thương lượng 0972.884.10năm (ngọc linh)"
